,source,author,title,description,url,urlToImage,publishedAt,content
33,"{'id': 'reuters', 'name': 'Reuters'}",,Novel action against Ooki crypto collective draws rebuke from commodities trading commissioner - Reuters.com,"The U.S. Commodities Futures Trading Commission has devised a theory to prevent the decentralized, amorphous crypto collectives known as DAOs from capitalizing on their diffuse structure to evade liability.",https://www.reuters.com/legal/government/novel-action-against-ooki-crypto-collective-draws-rebuke-commodities-trading-2022-09-23/,https://www.reuters.com/resizer/kp0hhINXScEOhIARNoFfPazyt5E=/728x381/smart/filters:quality(80)/cloudfront-us-east-2.images.arcpublishing.com/reuters/F2SYJURMCNMH5JEAGTYQHDI4Y4.jpg,2022-09-23T20:49:00Z,"(Reuters) - The U.S. Commodities Futures Trading Commission has devised a theory to prevent the decentralized, amorphous crypto collectives known as DAOs from capitalizing on their diffuse structure … [+6582 chars]"
34,"{'id': 'reuters', 'name': 'Reuters'}",,Liverpool expands partnership with NFT fantasy sports startup Sorare - Reuters,"Liverpool football club is deepening its ties with the crypto world by expanding a partnership with French blockchain-based sports startup Sorare, the company said in a statement on Thursday.",https://www.reuters.com/technology/liverpool-expands-partnership-with-nft-fantasy-sports-startup-sorare-2022-09-22/,https://www.reuters.com/resizer/8CilIck4JUcN0vmAlzyVRD-Esgw=/1200x628/smart/filters:quality(80)/cloudfront-us-east-2.images.arcpublishing.com/reuters/IJEMDZNCIZM47LSVDSBNLI3X3U.jpg,2022-09-22T13:07:00Z,"LONDON, Sept 22 (Reuters) - Liverpool football club is deepening its ties with the crypto world by expanding a partnership with French blockchain-based sports startup Sorare, the company said in a st… [+1990 chars]"
35,"{'id': 'reuters', 'name': 'Reuters'}",,Indonesia's tech firm GoTo buys local crypto exchange for $8.4 mln - Reuters,"Indonesia's biggest tech firm PT GoTo Gojek Tokopedia Tbk (GoTo) entered cryptocurrency business by acquiring local crypto exchange PT Kripto Maksima Koin in a bid to diversify its services, GoTo said in a statement.",https://www.reuters.com/technology/indonesias-tech-firm-goto-buys-local-crypto-exchange-84-mln-2022-08-29/,https://www.reuters.com/pf/resources/images/reuters/reuters-default.png?d=108,2022-08-29T15:58:00Z,"JAKARTA, Aug 29 (Reuters) - Indonesia's biggest tech firm PT GoTo Gojek Tokopedia Tbk (GoTo) entered cryptocurrency business by acquiring local crypto exchange PT Kripto Maksima Koin in a bid to dive… [+1302 chars]"
36,"{'id': 'reuters', 'name': 'Reuters'}",,"Indonesia to tighten rules for crypto exchanges, ensure more local control - Reuters","Indonesia's trade ministry plans to issue a new rule governing crypto asset exchanges, requiring two-thirds of the board of directors and commissioners to be Indonesian citizens and reside in the country, a deputy minister said Tuesday.",https://www.reuters.com/markets/currencies/indonesia-tighten-rules-crypto-exchanges-ensure-more-local-control-2022-09-20/,https://www.reuters.com/resizer/J4Akbfv8v71Ol3Dflc5kF-hddwY=/1200x628/smart/filters:quality(80)/cloudfront-us-east-2.images.arcpublishing.com/reuters/QRLMAXIJRJKWTFPUUQQDGBYBHY.jpg,2022-09-20T13:37:00Z,"JAKARTA, Sept 20 (Reuters) - Indonesia's trade ministry plans to issue a new rule governing crypto asset exchanges, requiring two-thirds of the board of directors and commissioners to be Indonesian c… [+1660 chars]"
37,"{'id': 'business-insider', 'name': 'Business Insider'}",prosen@insider.com (Phil Rosen),"Tornado Cash was the preferred 'laundering tool' for most NFT scammers before it was sanctioned by the US Treasury, says Elliptic","The crypto mixing platform was the ""laundering tool of choice"" for 52% of NFT scammers, Elliptic Enterprises wrote in a report.",https://markets.businessinsider.com/news/currencies/tornado-cash-nft-us-sanctions-cryptocurrency-crypto-korea-assets-north-2022-8,https://i.insider.com/63076b23830ed800183fb376?width=1200&format=jpeg,2022-08-25T13:18:29Z,"Bad actors turned to Tornado Cash as their preferred tool for laundering cryptocurrency proceeds from non-fungible token scams, research firm Elliptic Enterprises wrote in a Wednesday report. 
The p… [+1014 chars]"
38,"{'id': 'business-insider', 'name': 'Business Insider'}",jerb@insider.com (Jordan Parker Erb),Crypto influencers pedal questionable advice and profit off their viewers — no matter which way the market turns,"Crypto influencers have stepped up to offer advice to millions of people, and even though their advice is often wrong, they still profit off fans.",https://www.businessinsider.com/rise-of-cryptocurrency-hype-men-influencers-advice-2022-8,https://i.insider.com/630bce54417a0a0019107555?width=1200&format=jpeg,2022-08-29T10:21:18Z,"Welcome back, readers. The year is 2022, and our social media feeds are filled with influencers.
There are water park influencers, pet influencers, and LinkedIn influencers. And in another corner of… [+4121 chars]"
39,"{'id': 'business-insider', 'name': 'Business Insider'}",tmohamed@businessinsider.com (Theron Mohamed),'Rich Dad Poor Dad' author Robert Kiyosaki says a historic market crash is looming - and touts crypto as the best defense,"The personal-finance guru, who dismissed bitcoin as worthless in May, said it was vital for investors to get into crypto before the crash.",https://markets.businessinsider.com/news/stocks/rich-poor-dad-kiyosaki-stock-market-crash-dollar-crypto-bitcoin-2022-9,https://i.insider.com/5e2b32d662fa813e064000cb?width=1200&format=jpeg,2022-09-13T07:33:43Z,"Investors are barreling towards a catastrophic market collapse, and should buy cryptocurrencies before they usurp the US dollar and transform the entire financial system, Robert Kiyosaki told his fol… [+1736 chars]"
40,"{'id': 'business-insider', 'name': 'Business Insider'}",insider@insider.com (Ryan Austin),Altcoins are the alternative digital currencies to bitcoin — here's what they are and how they work,"Altcoins, or alternative coins, are any cryptocurrencies not bitcoin. Learn how altcoins emerged and evolved into a driving force in crypto markets.",https://www.businessinsider.com/personal-finance/what-is-altcoin,https://i.insider.com/6112cbf27ab071001878ec71?width=1200&format=jpeg,2022-09-20T21:08:35Z,"Insider's experts choose the best products and services to help make smart decisions with your money (heres how). In some cases, we receive a commission from our our partners, however, our opinions a… [+17380 chars]"
41,"{'id': 'business-insider', 'name': 'Business Insider'}",gkay@insider.com (Grace Kay),Dogecoin creator claims Mark Cuban is running a crypto 'grift:' He seems to have 'drunk the Kool-Aid',"""Sounds like the same thing that has been said about every new technology I've been involved in,"" Mark Cuban told Insider.",https://www.businessinsider.com/dogecoin-creator-mark-cuban-running-crypto-grift-2022-9,https://i.insider.com/631b55450a329a0011e3a50b?width=1200&format=jpeg,2022-09-09T15:38:26Z,"Dogecoin Co-Creator Jackson Palmer had some harsh words for crypto enthusiasts like Mark Cuban.
In an interview with Insider, Palmer said Cuban seems to have ""drunk the Kool-Aid"" when it comes to cr… [+3475 chars]"
42,"{'id': 'business-insider', 'name': 'Business Insider'}",insider@insider.com (Carla Mozée),Sam Bankman-Fried says his bailouts of sputtering crypto firms were snap judgments and the results have been mixed,FTX's Sam Bankman-Fried told Bloomberg the goal in spearheading crypto bailout deals was to backstop companies rather than make a fortune.,https://markets.businessinsider.com/news/currencies/sam-bankman-fried-crypto-bitcoin-bailouts-ftx-voyager-digital-blockfi-2022-8,https://i.insider.com/6132030b9ef1e50018f9a1ba?width=1200&format=jpeg,2022-08-31T16:58:15Z,"Billionaire Sam Bankman-Fried has stepped up this year to throw financial lifelines to struggling cryptocurrency firms and the results have been ""mixed,"" he told Bloomberg. 
The ongoing ""crypto wint… [+2210 chars]"
43,"{'id': 'business-insider', 'name': 'Business Insider'}",insider@insider.com (Carla Mozée),Bitcoin jumps more than 10% as risk appetite ramps up on a pullback in the US dollar from 20-year highs,"Bitcoin bounced above $21,000 for the first time in two weeks, helping the broader crypto market recapture a valuation of more than $1 trillion.",https://markets.businessinsider.com/news/currencies/bitcoin-price-today-cryptocurrencies-stocks-us-dollar-crypto-markets-ethereum-2022-9,https://i.insider.com/62faacfff16a0d0018e69ae1?width=1200&format=jpeg,2022-09-09T19:07:59Z,"Bitcoin leapt to a two-week high Friday as a drop in the strong US dollar helped fuel a jump in stocks and other risk assets. 
Bitcoin gained as much as 13% to $21,375.38, the first time the price h… [+2116 chars]"
44,"{'id': 'business-insider', 'name': 'Business Insider'}",prosen@insider.com (Phil Rosen),"Crypto parties are still raging in the bear market. Here's what it's like at Mainnet, where tickets cost $2,100 and attendees network on yachts.","Insider's Phil Rosen was on the ground at Mainnet in New York this week, where the party was still raging through the depths of crypto winter.",https://markets.businessinsider.com/news/currencies/messari-mainnet-yacht-parties-and-2100-tickets-2022-bear-market-2022-9,https://i.insider.com/632de2c9329bac00182efe5e?width=1200&format=jpeg,2022-09-24T12:15:00Z,"The Messari Mainnet crypto conference in New York drew about 2,000 attendees in person this week, with bullishness still running high and conference-goers ready to party even as bitcoin and ether, th… [+4771 chars]"
45,"{'id': 'the-verge', 'name': 'The Verge'}",Tom Warren,Nvidia to announce next-gen GPU architecture in September amid RTX 4090 rumors,"Nvidia is getting ready to announce its next-gen GPU architecture. Codenamed Lovelace, it’s expected to lay the foundations for the RTX 40-series GPUs.",https://www.theverge.com/2022/8/25/23321307/nvidia-next-gen-gpu-architecture-rtx-40-series-gtc-2022,https://cdn.vox-cdn.com/thumbor/veMh_fTCaXM9jyzunIzLKndS8UQ=/0x146:2040x1214/fit-in/1200x630/cdn.vox-cdn.com/uploads/chorus_asset/file/16303089/DSC00697.jpg,2022-08-25T08:51:20Z,"RTX 40-series cards could be on the way soon
If you buy something from a Verge link, Vox Media may earn a commission. See our ethics statement.
Photo by Sam Byford / The Verge
Nvidia is getting re… [+2278 chars]"
46,"{'id': 'reuters', 'name': 'Reuters'}",,Binance to convert users' USDC into its own stablecoin - Reuters,"Binance, the world's largest crypto exchange, said on Monday it is introducing ""BUSD Auto-Conversion,"" which will be used to convert any existing user balances and new deposits of USD Coin (USDC), Pax Dollar (USDP) and True USD (TUSD) into its own stablecoin.",https://www.reuters.com/technology/binance-convert-users-usdc-into-its-own-stablecoin-2022-09-05/,https://www.reuters.com/resizer/KPy-CbHD2qgsS6eQyJaTQhTkz08=/1200x628/smart/filters:quality(80)/cloudfront-us-east-2.images.arcpublishing.com/reuters/O2I777GS45LQBIKLNQIJSSQDCI.jpg,2022-09-05T21:54:00Z,"Sept 5 (Reuters) - Binance, the world's largest crypto exchange, said on Monday it is introducing ""BUSD Auto-Conversion,"" which will be used to convert any existing user balances and new deposits of … [+918 chars]"
47,"{'id': 'reuters', 'name': 'Reuters'}",,Tether wants Roche Freedman off case over founder's alleged conflict - Reuters,Tether wants Roche Freedman removed from a case against the cryptocurrency company after allegations that one of the law firm's founders abused investor lawsuits to aid a corporate client.,https://www.reuters.com/legal/government/tether-wants-roche-freedman-off-case-over-founders-alleged-conflict-2022-09-01/,https://www.reuters.com/pf/resources/images/reuters/reuters-default.png?d=109,2022-09-01T18:52:00Z,"<ul><li>
Summary</li><li>
Companies</li><li>
Law firms</li><li>
Related documents</li></ul>
(Reuters) - Tether wants Roche Freedman removed from a case against the cryptocurrency company after a… [+2796 chars]"
48,"{'id': 'business-insider', 'name': 'Business Insider'}",ztayeb@businessinsider.com (Zahra Tayeb),"Anthony Scaramucci says bear markets 'suck,' and Skybridge only took Sam-Bankman Fried's deal because of its 'mediocre' performance","Sam Bankman-Fried's acquisition of SkyBridge Capital means ""people don't think you're going out of business,"" Scaramucci said.",https://www.businessinsider.com/scaramucci-says-bear-markets-suck-sbf-deal-mediocre-performance-2022-9,https://i.insider.com/61a107831ca5280018116047?width=1200&format=jpeg,2022-09-13T11:35:03Z,"Hedge fund manager Anthony Scaramucci lamented bear markets, saying they ""suck"" because of how much they've hurt his business. 
Scaramucci told the Financial Times Monday that his company, SkyBridge… [+2159 chars]"
49,"{'id': 'business-insider', 'name': 'Business Insider'}",ztayeb@businessinsider.com (Zahra Tayeb),"Anthony Scaramucci says bear markets 'suck,' and Skybridge only took Sam-Bankman Fried's deal because of its 'mediocre' performance","Sam Bankman-Fried's acquisition of SkyBridge Capital means ""people don't think you're going out of business,"" Scaramucci said.",https://markets.businessinsider.com/news/currencies/scaramucci-says-bear-markets-suck-sbf-deal-mediocre-performance-2022-9,https://i.insider.com/61a107831ca5280018116047?width=1200&format=jpeg,2022-09-13T11:35:03Z,"Hedge fund manager Anthony Scaramucci lamented bear markets, saying they ""suck"" because of how much they've hurt his business. 
Scaramucci told the Financial Times his company, SkyBridge Capital has… [+2164 chars]"
50,"{'id': 'reuters', 'name': 'Reuters'}",,Thai lender SCBX scraps $500 mln acquisition of crypto exchange Bitkub - Reuters,"Thailand's oldest lender, SCBX Pcl <a href=""https://www.reuters.com/companies/SCB.BK"" target=""_blank"">(SCB.BK)</a> said on Thursday it was pulling out of a $500 million deal to buy crypto exchange Bitkub, saying the startup needed time to fix regulatory issue…",https://www.reuters.com/markets/deals/thai-lender-scbx-scraps-500-mln-acquisition-crypto-exchange-bitkub-2022-08-25/,https://www.reuters.com/resizer/xTN_w6bEGIrdArCCNImqU8X1WnY=/1200x628/smart/filters:quality(80)/cloudfront-us-east-2.images.arcpublishing.com/reuters/VEMNAX3DIBMGZGCA5HIDFVEFVM.jpg,2022-08-25T07:12:00Z,"BANGKOK, Aug 25 (Reuters) - Thailand's oldest lender, SCBX Pcl (SCB.BK) said on Thursday it was pulling out of a $500 million deal to buy crypto exchange Bitkub, saying the startup needed time to fix… [+1218 chars]"
51,"{'id': 'reuters', 'name': 'Reuters'}",,Cboe says Robinhood and Virtu among potential equity partners in crypto exchange - Reuters,"Cboe Global Markets Inc <a href=""https://www.reuters.com/companies/CBOE.Z"" target=""_blank"">(CBOE.Z)</a> on Thursday said it is in discussions with several market participants, including retail brokers and market makers, about taking strategic stakes in its re…",https://www.reuters.com/markets/us/cboe-says-robinhood-virtu-among-potential-equity-partners-crypto-exchange-2022-08-25/,https://www.reuters.com/resizer/J31baCTB_IftW3k-DDBr1yQ5gyk=/1200x628/smart/filters:quality(80)/cloudfront-us-east-2.images.arcpublishing.com/reuters/3XXXH6VWAFKLNABL34EO572H2U.jpg,2022-08-25T15:00:00Z,"Aug 25 (Reuters) - Cboe Global Markets Inc (CBOE.Z) on Thursday said it is in discussions with several market participants, including retail brokers and market makers, about taking strategic stakes i… [+1608 chars]"
52,"{'id': 'reuters', 'name': 'Reuters'}",,State securities regulators seek more transparency in Celsius crypto bankruptcy - Reuters,"State securities regulators from Texas, Vermont and Wisconsin on Wednesday pushed for greater transparency in the bankruptcy of cryptocurrency lender Celsius Network LLC, joining the U.S. Department of Justice's call for a court-appointed examiner to ensure t…",https://www.reuters.com/legal/litigation/state-securities-regulators-seek-more-transparency-celsius-crypto-bankruptcy-2022-09-07/,https://www.reuters.com/resizer/iDrJ3KoGr6uC7nKcdYCL-H6rSxk=/728x381/smart/filters:quality(80)/cloudfront-us-east-2.images.arcpublishing.com/reuters/HRTHY7YFRFPXHI2UZDISGXD33U.jpg,2022-09-07T22:25:00Z,"<ul><li>
Summary</li><li>
Companies</li><li>
Law firms</li></ul>
(Reuters) - State securities regulators from Texas, Vermont and Wisconsin on Wednesday pushed for greater transparency in the bank… [+3479 chars]"
53,"{'id': 'reuters', 'name': 'Reuters'}",,"U.S. Senate to grill SEC's Gensler over climate, China and crypto - Reuters","An aggressive regulator is critical to maintaining the United States as the ""gold standard"" for capital markets, U.S. Securities and Exchange Commission (SEC) chair Gary Gensler will tell the U.S. Senate Banking Committee on Thursday.",https://www.reuters.com/markets/us/us-senate-grill-secs-gensler-over-climate-china-crypto-2022-09-15/,https://www.reuters.com/resizer/QtJ5HCft4saiYmOPuY5JGj0jGuI=/1200x628/smart/filters:quality(80)/cloudfront-us-east-2.images.arcpublishing.com/reuters/YQPKDIDX4RN7NINWHQ4ARP7MPU.jpg,2022-09-15T10:15:00Z,"WASHINGTON, Sept 15 (Reuters) - An aggressive regulator is critical to maintaining the United States as the ""gold standard"" for capital markets, U.S. Securities and Exchange Commission (SEC) chair Ga… [+3441 chars]"
54,"{'id': 'reuters', 'name': 'Reuters'}",,"Crypto exchange Kraken has no U.S. SEC registration plans, says incoming CEO - Reuters","Cryptocurrency exchange Kraken has no plans to delist tokens the U.S. Securities and Exchange Commission has labeled as securities, or to register with the agency as a market intermediary, said incoming chief executive officer Dave Ripley on Thursday.",https://www.reuters.com/technology/crypto-exchange-kraken-has-no-us-sec-registration-plans-says-incoming-ceo-2022-09-23/,https://www.reuters.com/resizer/NUqw2rKjOFS14JJCGKU0XjSprEY=/1200x628/smart/filters:quality(80)/cloudfront-us-east-2.images.arcpublishing.com/reuters/XQTEXE4OIBNX3LH53IFRGTQKXQ.jpg,2022-09-23T10:13:00Z,"Sept 23 (Reuters) - Cryptocurrency exchange Kraken has no plans to delist tokens the U.S. Securities and Exchange Commission has labeled as securities, or to register with the agency as a market inte… [+2778 chars]"
55,"{'id': 'reuters', 'name': 'Reuters'}",,EXCLUSIVE U.S. sought records on Binance CEO for crypto money laundering probe - Reuters,"U.S. federal prosecutors asked Binance, the world's largest cryptocurrency exchange, to provide extensive internal records about its anti-money laundering checks, along with communications involving its chief executive and founder Changpeng Zhao, according to…",https://www.reuters.com/technology/exclusive-us-sought-records-binance-ceo-crypto-money-laundering-probe-2022-09-01/,https://www.reuters.com/resizer/Qr8-pMfjB6D8CgK24KUZ_iVS5WQ=/1200x628/smart/filters:quality(80)/cloudfront-us-east-2.images.arcpublishing.com/reuters/UOLJ2RZLOZJ3RPIGRH2AHZTF34.jpg,2022-09-01T12:07:00Z,"LONDON, Sept 1 (Reuters) - U.S. federal prosecutors asked Binance, the world's largest cryptocurrency exchange, to provide extensive internal records about its anti-money laundering checks, along wit… [+8045 chars]"
56,"{'id': 'reuters', 'name': 'Reuters'}",,Law firms seek to oust Roche Freedman from Tether crypto case - Reuters,"Law firms seeking to lead a class-action lawsuit against stablecoin creator Tether on behalf of cryptocurrency investors have seized on secretly recorded comments by a lawyer at a competitor firm, Roche Freedman, to try to oust it from the litigation.",https://www.reuters.com/legal/transactional/law-firms-seek-oust-roche-freedman-tether-crypto-case-2022-09-06/,https://www.reuters.com/resizer/T01mfnkxj8pqZh7MYjP18Iyw_c0=/728x381/smart/filters:quality(80)/cloudfront-us-east-2.images.arcpublishing.com/reuters/U32NKTQZJBN4DPWAJNJCBYNDCM.jpg,2022-09-06T20:36:00Z,"<ul><li>
Summary</li><li>
Companies</li><li>
Law firms</li><li>
Related documents</li></ul>
(Reuters) - Law firms seeking to lead a class-action lawsuit against stablecoin creator Tether on beha… [+3020 chars]"
57,"{'id': 'reuters', 'name': 'Reuters'}",,Lawyer of alleged crypto launderer urges Russia to discuss prisoner swap - letter - Reuters,The lawyer of a Russian man accused of laundering more than $4 billion through the digital currency bitcoin urged Moscow on Monday to begin negotiations with the United States to include his client in a potential prisoner swap.,https://www.reuters.com/world/europe/lawyer-alleged-crypto-launderer-urges-russia-discuss-prisoner-swap-letter-2022-09-05/,https://www.reuters.com/resizer/ibTu9Ia1Og3Fyo5MFwGwsUetBcw=/1200x628/smart/filters:quality(80)/cloudfront-us-east-2.images.arcpublishing.com/reuters/R7M3WV7F4ZOSFGXHLJJRLKQ6MA.jpg,2022-09-05T19:17:00Z,"MOSCOW, Sept 5 (Reuters) - The lawyer of a Russian man accused of laundering more than $4 billion through the digital currency bitcoin urged Moscow on Monday to begin negotiations with the United Sta… [+2472 chars]"
58,"{'id': 'reuters', 'name': 'Reuters'}",,Crypto law firm Roche Freedman fights to stay in bitcoin case after videos surface - Reuters,A hotly contested disqualification fight at the 11th U.S. Circuit Court of Appeals should provide a good indication of just how much damage the crypto law firm Roche Freedman is facing after last month’s revelation of surreptitious video recordings of name pa…,https://www.reuters.com/legal/transactional/crypto-law-firm-roche-freedman-fights-stay-bitcoin-case-after-videos-surface-2022-09-20/,https://www.reuters.com/resizer/Y3XdCfNWUjotxtL8RqJGQ2FseLg=/728x381/smart/filters:quality(80)/cloudfront-us-east-2.images.arcpublishing.com/reuters/Z2M2ZRGOCRO3BAGWH3Z34WGOEI.jpg,2022-09-20T21:33:00Z,(Reuters) - A hotly contested disqualification fight at the 11th U.S. Circuit Court of Appeals should provide a good indication of just how much damage the crypto law firm Roche Freedman is facing af… [+6936 chars]
59,"{'id': 'business-insider', 'name': 'Business Insider'}",gglover@insider.com (George Glover),Financial watchdog warns UK to be wary of dealing with Sam Bankman-Fried's crypto exchange FTX,"Sam Bankman-Fried's FTX ""is not authorized by us and is targeting people in the UK,"" the Financial Conduct Authority said.",https://markets.businessinsider.com/news/currencies/crypto-exchange-ftx-uk-financial-regulator-watchdog-sam-bankman-fried-2022-9,https://i.insider.com/63285f824f92910018839990?width=1200&format=jpeg,2022-09-19T13:34:26Z,"The UK's financial watchdog has warned Brits against dealing with Sam Bankman-Fried's crypto exchange FTX as it steps up its attempts to regulate offshore digital asset firms.
The Financial Conduct … [+1361 chars]"
60,"{'id': 'business-insider', 'name': 'Business Insider'}",bevans@insider.com (Brian Evans),Billionaire Carlyle co-founder David Rubenstein says he's invested in crypto companies and doesn't expect Congress to over-regulate the industry,"""Young people tend to have the intelligence and energy to kind of get trends started,"" Rubenstein said in an interview with CNBC.",https://markets.businessinsider.com/news/currencies/david-rubenstein-crypto-investments-bitcoin-ether-markets-news-2022-9,https://i.insider.com/6310b9383e08f700196c5608?width=1200&format=jpeg,2022-09-01T14:18:04Z,"Billionaire David Rubenstein says he's personally invested in companies doing work in the cryptocurrency sector and is optimistic that government regulation won't hit the brakes on the industry. 
Ru… [+1164 chars]"
61,"{'id': 'business-insider', 'name': 'Business Insider'}",aweinman@businessinsider.com (Aaron Weinman),"It took seven months and an audit for Crypto.com to realize its $10 million error, but a lucky Australian recipient used the cash to nab her dream home","The crypto company took seven months to realize it had accidentally wired Thevamanogari Manivel the extra money, but she had already put a portion of the cash toward a $1.35 million home.",https://www.businessinsider.com/crypto-thevamanogari-manivel-australia-error-audit-lawsuit-digital-assets-2022-9,https://i.insider.com/630fc2ba3fe7c40019e4c475?width=1200&format=jpeg,2022-08-31T23:30:00Z,"Hi. I'm Aaron Weinman. I remember one day after high school, I went to the local ""milk bar"" (Australia's version of the bodega) to withdraw $50 from the ATM. I was excited. I was off to the ""shops"" (… [+4561 chars]"
62,"{'id': 'business-insider', 'name': 'Business Insider'}",gglover@insider.com (George Glover),"Ethereum Merge has completed its long-awaited update, Buterin says","The merge moves the Ethereum blockchain to a proof-of-stake mechanism, slashing its energy usage and so making it more appealing to institutional investors.",https://markets.businessinsider.com/news/currencies/crypto-news-ethereum-finalizes-merge-upgrade-vitalik-buterin-says-bitcoin-2022-9,https://i.insider.com/615c3f521725d20018b7c5b8?width=1200&format=jpeg,2022-09-15T09:22:26Z,"The Ethereum blockchain completed its long-awaited Merge update early Thursday morning, the crypto project's cofounder Vitalik Buterin has said.
The upgrade promises to cut energy consumption for th… [+2331 chars]"
