,source,author,title,description,url,urlToImage,publishedAt,content
95,"{'id': 'business-insider', 'name': 'Business Insider'}",bevans@insider.com (Brian Evans),Legendary investor Mark Mobius says the Fed will hike interest rates as high as 9% if inflation stays high,"Mark Mobius thinks the Fed will hike rates as high as 9% to tame inflation, adding that it believe rates must be higher than inflation to bring it down.",https://markets.businessinsider.com/news/stocks/mark-mobius-interest-rates-could-hit-9-percent-borrowing-fed-2022-9,https://i.insider.com/6321e433e555ad0018529769?width=1200&format=jpeg,2022-09-14T15:18:29Z,"The Federal Reserve could hike interest rates as high as 9%, according to Mark Mobius. 
The famed investor told Bloomberg TV Wednesday that because inflation has remained persistently high, ""the Fed… [+1066 chars]"
96,"{'id': 'business-insider', 'name': 'Business Insider'}",bevans@insider.com (Brian Evans),Legendary investor Mark Mobius says the Fed will hike interest rates as high as 9% if inflation stays high,"Mark Mobius thinks the Fed will hike rates as high as 9% to tame inflation, adding that it believe rates must be higher than inflation to bring it down.",https://www.businessinsider.com/mark-mobius-interest-rates-could-hit-9-percent-borrowing-fed-2022-9,https://i.insider.com/6321e433e555ad0018529769?width=1200&format=jpeg,2022-09-14T15:18:29Z,"The Federal Reserve could hike interest rates as high as 9%, according to Mark Mobius. 
The famed investor told Bloomberg TV Wednesday that because inflation has remained persistently high, ""the Fed… [+1066 chars]"
97,"{'id': 'business-insider', 'name': 'Business Insider'}",prosen@insider.com (Phil Rosen),US stocks continue sell-off as traders brace for more Fed rate hikes later this week,"Last week, global equities saw their worst five-day stretch since June as investors anticipate another jumbo rate hike from the Federal Reserve.",https://markets.businessinsider.com/news/stocks/stock-market-news-today-indexes-slide-as-traders-brace-for-fed-hike-2022-9,https://i.insider.com/63286def4f92910018839bd3?width=1200&format=jpeg,2022-09-19T13:37:48Z,"US stocks dropped Monday ahead of the Federal Reserve's two-day meeting, which begins Tuesday. The dip is a continuation of Friday's sell-off, in which indexes capped off their worst five-day stretch… [+1262 chars]"
98,"{'id': 'business-insider', 'name': 'Business Insider'}",gkay@insider.com (Grace Kay),Dogecoin creator says it 'annoyed' him when Elon Musk tried to send the cryptocurrency 'to the moon',"""He has a tendency to latch onto communities that he can then kind of absorb into his cult of personality,"" Jackson Palmer said.",https://www.businessinsider.com/dogecoin-creator-annoyed-elon-musk-promoted-cryptocurrency-2022-9,https://i.insider.com/631b58410a329a0011e3a646?width=1200&format=jpeg,2022-09-10T11:30:00Z,"Dogecoin co-creator Jackson Palmer said it bothered him when Elon Musk and WallStreetBets' copycat Reddit group SatoshiBets attempted to send the meme currency ""to the moon"" last year.
In an intervi… [+3349 chars]"
99,"{'id': 'business-insider', 'name': 'Business Insider'}",insider@insider.com (Carla Mozée),US stocks drop for a 3rd day as Treasury yields spike and recession fears grow after Fed rate hike,The Fed-policy-sensitive 2-year Treasury yield rose to 4.1% for a fresh 15-year high. The 10-year Treasury yield leapt 19 basis points to 3.7%.,https://markets.businessinsider.com/news/stocks/stock-market-news-today-sp-500-extends-fed-spurred-selloff-2022-9,https://i.insider.com/62fab5be306b6300192ae959?width=1200&format=jpeg,2022-09-22T20:15:34Z,"US stocks finished lower Thursday, with the S&amp;P 500 sliding to a two-month low during the session as Treasury yields continued to climb following the Federal Reserve's latest interest rate increa… [+1719 chars]"
100,"{'id': 'business-insider', 'name': 'Business Insider'}",insider@insider.com (Carter Kilmann),5 crypto scams to know before you start trading coins,Scammers use various techniques to rob crypto investors. Here are five scams to know and how to avoid them.,https://www.businessinsider.com/personal-finance/crypto-scams,https://i.insider.com/61a79f2b0ed48c0019e53547?width=1200&format=jpeg,2022-09-16T21:42:21Z,"Insider's experts choose the best products and services to help make smart decisions with your money (heres how). In some cases, we receive a commission from our our partners, however, our opinions a… [+9504 chars]"
101,"{'id': 'business-insider', 'name': 'Business Insider'}",prosen@insider.com (Phil Rosen),"Tornado Cash was the preferred 'laundering tool' for most NFT scammers before it was sanctioned by the US Treasury, says Elliptic","The crypto mixing platform was the ""laundering tool of choice"" for 52% of NFT scammers, Elliptic Enterprises wrote in a report.",https://markets.businessinsider.com/news/currencies/tornado-cash-nft-us-sanctions-cryptocurrency-crypto-korea-assets-north-2022-8,https://i.insider.com/63076b23830ed800183fb376?width=1200&format=jpeg,2022-08-25T13:18:29Z,"Bad actors turned to Tornado Cash as their preferred tool for laundering cryptocurrency proceeds from non-fungible token scams, research firm Elliptic Enterprises wrote in a Wednesday report. 
The p… [+1014 chars]"
102,"{'id': 'business-insider', 'name': 'Business Insider'}",insider@insider.com (Louis DeNicola),What is cryptocurrency? Here's what to know about this increasingly popular digital currency before getting involved,"Cryptocurrencies are decentralized, digital currencies that use blockchain technology to manage transactions and keep them secure.",https://www.businessinsider.com/personal-finance/what-is-cryptocurrency,https://i.insider.com/61c08aecbc281e00184ed412?width=1200&format=jpeg,2022-09-23T21:15:06Z,"Insider's experts choose the best products and services to help make smart decisions with your money (heres how). In some cases, we receive a commission from our our partners, however, our opinions a… [+8777 chars]"
103,"{'id': 'the-verge', 'name': 'The Verge'}",Jay Peters,Tens of thousands of viewers are watching a fake Apple crypto scam on YouTube right now,"A bogus channel is pretending to live stream an Apple event that actually appears to be a crypto scam. In the chat, the streamer is linking to a shady-looking crypto site.",https://www.theverge.com/2022/9/7/23342120/apple-fake-youtube-live-stream-crypto-scam,https://cdn.vox-cdn.com/thumbor/UkdJWfOptBg1UCnodMD5TYYhq7I=/0x25:1280x695/fit-in/1200x630/cdn.vox-cdn.com/uploads/chorus_asset/file/24004112/Apple_Event_Live._Ceo_of_Apple_Tim_Cook__Apple___Metaverse_in_2022._3_56_22_screenshot.png,2022-09-08T02:19:28Z,"To be absolutely clear: Apple is not hosting a crypto event
A screenshot from a bogus Apple live stream that actually seems to be a crypto scam.
Screenshot by Jay Peters / The Verge
Someone on You… [+2422 chars]"
104,"{'id': 'the-verge', 'name': 'The Verge'}",Ash Parrish,Streamer involved in Twitch gambling saga now embroiled in sexual assault allegations,"Mizkif, owner of the Texas-based OTKNetwork, was accused of covering up and downplaying the sexual assault of a streamer after he took a jab at Trainwreckstv’s alleged crypto scam.",https://www.theverge.com/2022/9/20/23363760/mizkif-trainwreckstv-sexual-harassment-twitch-adrianahlee,https://cdn.vox-cdn.com/thumbor/YjfVc0m0nkihGe8AKxm1b1mOyaA=/0x0:1257x707/1200x628/filters:focal(629x354:630x355)/cdn.vox-cdn.com/uploads/chorus_asset/file/24039590/Screenshot_2022_09_20_162856.jpg,2022-09-20T20:31:45Z,"Streamer involved in Twitch gambling saga now embroiled in sexual assault allegations
Streamer involved in Twitch gambling saga now embroiled in sexual assault allegations
 / After taking shots at … [+3773 chars]"
105,"{'id': 'techcrunch', 'name': 'TechCrunch'}",Sarah Perez,Apple settles lawsuit with developer over App Store rejections and scams,"An app developer’s lawsuit over App Store rejections, scams and fraud has ended in a settlement agreement after court filings show a request to dismiss the suit earlier this summer. The plaintiff, app developer and former Pinterest engineer Kosta Eleftheriou,…",https://techcrunch.com/2022/09/01/apple-settles-lawsuit-with-developer-over-app-store-rejections-and-scams/,https://techcrunch.com/wp-content/uploads/2022/07/app-store-ios-2022-b.jpg?w=712,2022-09-01T19:21:03Z,"An app developer’s lawsuit over App Store rejections, scams and fraud has ended in a settlement agreement after court filings show a request to dismiss the suit earlier this summer. The plaintiff, ap… [+5948 chars]"
106,"{'id': 'techcrunch', 'name': 'TechCrunch'}",Taylor Hatmaker,Twitch responds to gambling scam drama by banning some betting sites,"Twitch is cracking down on some gambling sites after a streamer scammed his peers out of tens of thousands of dollars to fuel a betting habit, kicking off a firestorm about how the platform should handle games of chance in the process. Over the weekend, ItsSl…",https://techcrunch.com/2022/09/20/twitch-sliker-gambling-drama/,"https://techcrunch.com/wp-content/uploads/2021/10/twitch-coin-glitch.jpg?resize=1200,675",2022-09-21T05:59:13Z,"Twitch is cracking down on some gambling sites after a streamer scammed his peers out of tens of thousands of dollars to fuel a betting habit, kicking off a firestorm about how the platform should ha… [+3548 chars]"
107,"{'id': 'techcrunch', 'name': 'TechCrunch'}",Lucas Matney,Arpeggi Labs banks a16z funding to build web3 music creation software,"The quest to define what exactly a web3 use case looks like hasn’t always been easy, but has allowed plenty of founders to get creative in building out products designed to tap the ethos of decentralization and the business opportunities of the creator econom…",https://techcrunch.com/2022/09/14/arpeggi-labs-banks-a16z-funding-to-build-web3-music-creation-software/,"https://techcrunch.com/wp-content/uploads/2022/09/Screen-Shot-2022-09-14-at-12.06.49-PM.png?resize=1200,713",2022-09-14T19:17:36Z,"The quest to define what exactly a web3 use case looks like hasn’t always been easy, but has allowed plenty of founders to get creative in building out products designed to tap the ethos of decentral… [+2153 chars]"
108,"{'id': 'business-insider', 'name': 'Business Insider'}",bnguyen@insider.com (Britney Nguyen),Facebook scammers recruited into the shadowy job after being trafficked say they were punished with push-ups or tased for failing,"One of the workers said workers who didn't meet their quota of ""clients"" for the Facebook scam had to do 50 push-ups for each client they missed.",https://www.businessinsider.com/facebook-scammers-cambodia-trafficked-indonesia-punished-taser-push-ups-report-2022-9,https://i.insider.com/632ca4fef576c60018fc453c?width=1200&format=jpeg,2022-09-22T19:27:19Z,"A new investigation into the trafficking of Indonesian nationals into Cambodia sheds light on some of the working conditions of those caught up the shadowy world of scamming people on Facebook.
Indo… [+2466 chars]"
109,"{'id': 'reuters', 'name': 'Reuters'}",,Malaysia brings home 15 victims of Cambodian cybercrime racket - Reuters,"Malaysian authorities have rescued 15 victims of suspected cybercrime rackets in Cambodia, its foreign ministry said, as the government steps up efforts to help hundreds of its citizens trapped by similar operations across Southeast Asia.",https://www.reuters.com/world/asia-pacific/malaysia-brings-home-15-victims-cambodian-cybercrime-racket-2022-09-22/,https://www.reuters.com/pf/resources/images/reuters/reuters-default.png?d=111,2022-09-22T02:52:00Z,"KUALA LUMPUR, Sept 22 (Reuters) - Malaysian authorities have rescued 15 victims of suspected cybercrime rackets in Cambodia, its foreign ministry said, as the government steps up efforts to help hund… [+1318 chars]"
110,"{'id': 'business-insider', 'name': 'Business Insider'}",insider@insider.com (Louis DeNicola),What is cryptocurrency? Here's what to know about this increasingly popular digital currency before getting involved,"Cryptocurrencies are decentralized, digital currencies that use blockchain technology to manage transactions and keep them secure.",https://www.businessinsider.com/personal-finance/what-is-cryptocurrency,https://i.insider.com/61c08aecbc281e00184ed412?width=1200&format=jpeg,2022-09-23T21:15:06Z,"Insider's experts choose the best products and services to help make smart decisions with your money (heres how). In some cases, we receive a commission from our our partners, however, our opinions a… [+8777 chars]"
111,"{'id': 'business-insider', 'name': 'Business Insider'}",insider@insider.com (Carter Kilmann),5 crypto scams to know before you start trading coins,Scammers use various techniques to rob crypto investors. Here are five scams to know and how to avoid them.,https://www.businessinsider.com/personal-finance/crypto-scams,https://i.insider.com/61a79f2b0ed48c0019e53547?width=1200&format=jpeg,2022-09-16T21:42:21Z,"Insider's experts choose the best products and services to help make smart decisions with your money (heres how). In some cases, we receive a commission from our our partners, however, our opinions a… [+9504 chars]"
112,"{'id': 'business-insider', 'name': 'Business Insider'}",prosen@insider.com (Phil Rosen),"Tornado Cash was the preferred 'laundering tool' for most NFT scammers before it was sanctioned by the US Treasury, says Elliptic","The crypto mixing platform was the ""laundering tool of choice"" for 52% of NFT scammers, Elliptic Enterprises wrote in a report.",https://markets.businessinsider.com/news/currencies/tornado-cash-nft-us-sanctions-cryptocurrency-crypto-korea-assets-north-2022-8,https://i.insider.com/63076b23830ed800183fb376?width=1200&format=jpeg,2022-08-25T13:18:29Z,"Bad actors turned to Tornado Cash as their preferred tool for laundering cryptocurrency proceeds from non-fungible token scams, research firm Elliptic Enterprises wrote in a Wednesday report. 
The p… [+1014 chars]"
113,"{'id': 'the-verge', 'name': 'The Verge'}",Ash Parrish,Streamer involved in Twitch gambling saga now embroiled in sexual assault allegations,"Mizkif, owner of the Texas-based OTKNetwork, was accused of covering up and downplaying the sexual assault of a streamer after he took a jab at Trainwreckstv’s alleged crypto scam.",https://www.theverge.com/2022/9/20/23363760/mizkif-trainwreckstv-sexual-harassment-twitch-adrianahlee,https://cdn.vox-cdn.com/thumbor/YjfVc0m0nkihGe8AKxm1b1mOyaA=/0x0:1257x707/1200x628/filters:focal(629x354:630x355)/cdn.vox-cdn.com/uploads/chorus_asset/file/24039590/Screenshot_2022_09_20_162856.jpg,2022-09-20T20:31:45Z,"Streamer involved in Twitch gambling saga now embroiled in sexual assault allegations
Streamer involved in Twitch gambling saga now embroiled in sexual assault allegations
 / After taking shots at … [+3773 chars]"
114,"{'id': 'techcrunch', 'name': 'TechCrunch'}",Taylor Hatmaker,Elon Musk taps the Twitter whistleblower for help in his quest to get out of the deal,"With the Twitter trial date rapidly approaching, Elon Musk’s legal team sent a subpoena to former Twitter head of security Peiter “Mudge” Zatko, who filed a whistleblower complaint against the company that was made public last week. In the complaint,  Zatko a…",https://techcrunch.com/2022/08/29/elon-musk-twitter-whistleblower-zatko-subpoena/,https://techcrunch.com/wp-content/uploads/2022/05/GettyImages-1395371333.jpg?w=711,2022-08-29T21:41:04Z,"With the Twitter trial date rapidly approaching, Elon Musk’s legal team sent a subpoena to former Twitter head of security Peiter “Mudge” Zatko, who filed a whistleblower complaint against the compan… [+4830 chars]"
115,"{'id': 'the-verge', 'name': 'The Verge'}",Tom Warren,"Twitter starts testing an edit button, but you have to pay for it",Twitter is finally testing its edit button. Editable tweets will be available for some Twitter Blue subscribers in late September.,https://www.theverge.com/2022/9/1/23332363/twitter-edit-button-blue-subscription,https://cdn.vox-cdn.com/thumbor/jDjIUIi9gI8WQMyJNMafYe-Ny6I=/0x0:1496x926/fit-in/1200x630/filters:fill(ffffff)/cdn.vox-cdn.com/uploads/chorus_asset/file/23987733/IMG_8375.jpg,2022-09-01T12:52:48Z,"Twitter Blue subscribers get access later this month
Illustration by Alex Castro / The Verge
Twitter is now testing its highly-requested Edit Tweet feature. After years of memes and jokes, editable… [+2353 chars]"
116,"{'id': 'reuters', 'name': 'Reuters'}",,Cambodian police raid alleged cybercrime trafficking compounds | Reuters,"Cambodian authorities said raids are underway this week at suspected cybercrime compounds across the Southeast Asian country, uncovering evidence of human trafficking, illegal confinement and torture.",https://www.reuters.com/world/asia-pacific/cambodian-police-raid-alleged-cybercrime-trafficking-compounds-2022-09-21/,https://www.reuters.com/pf/resources/images/reuters/reuters-default.png?d=111,2022-09-21T06:42:01Z,"BANGKOK, Sept 21 (Reuters) - Cambodian authorities said raids are underway this week at suspected cybercrime compounds across the Southeast Asian country, uncovering evidence of human trafficking, il… [+3035 chars]"
117,"{'id': 'reuters', 'name': 'Reuters'}",Reuters Staff,Fugitive Turkish crypto fraud suspect arrested in Albania resort - Reuters,"Albanian police on Tuesday arrested the fugitive Turkish founder of crypto-exchange Thodex, wanted by Interpol for suspected crypto fraud and at large for a year, police and media said.",https://www.reuters.com/article/albania-turkey-cryptocurrencies-arrests-idUSKBN2Q011N,https://s1.reutersmedia.net/resources_v2/images/rcom-default.png?w=800,2022-08-30T13:06:00Z,"By Reuters Staff
TIRANA (Reuters) - Albanian police on Tuesday arrested the fugitive Turkish founder of crypto-exchange Thodex, wanted by Interpol for suspected crypto fraud and at large for a year,… [+1638 chars]"
118,"{'id': 'reuters', 'name': 'Reuters'}",,Fugitive Turkish crypto fraud suspect arrested in Albania resort - Reuters,"Albanian police on Tuesday arrested the fugitive Turkish founder of crypto-exchange Thodex, wanted by Interpol for suspected crypto fraud and at large for a year, police and media said.",https://www.reuters.com/world/fugitive-turkish-crypto-fraud-suspect-arrested-albania-resort-2022-08-30/,https://www.reuters.com/pf/resources/images/reuters/reuters-default.png?d=108,2022-08-30T13:05:00Z,"TIRANA, Aug 30 (Reuters) - Albanian police on Tuesday arrested the fugitive Turkish founder of crypto-exchange Thodex, wanted by Interpol for suspected crypto fraud and at large for a year, police an… [+1919 chars]"
119,"{'id': 'reuters', 'name': 'Reuters'}",,"Ransomware group BlackCat behind Italy's GSE hacking, researchers say - Reuters.com","Hacking group BlackCat was behind a recent attack on Italy's state-owned energy services firm GSE, stole a massive amount of data and threatened to publish if their demands were not met, according to security researchers and documents seen by Reuters.",https://www.reuters.com/technology/ransomware-group-blackcat-behind-italys-gse-hacking-researchers-say-2022-09-02/,https://www.reuters.com/resizer/enqAsaXcCMY9Zltx5kkJ4aFGSko=/1200x628/smart/filters:quality(80)/cloudfront-us-east-2.images.arcpublishing.com/reuters/RXWNWIVM7NLNPN74WQ52TWZK3I.jpg,2022-09-02T20:05:00Z,"STOCKHOLM/MILAN, Sept 2 (Reuters) - Hacking group BlackCat was behind a recent attack on Italy's state-owned energy services firm GSE, stole a massive amount of data and threatened to publish if thei… [+1892 chars]"
120,"{'id': 'business-insider', 'name': 'Business Insider'}",mloh@businessinsider.com (Matthew Loh),Elon Musk's crypto interview was broadcast on the South Korean government's YouTube channel that was hacked and renamed 'SpaceX Invest',The breach on Saturday morning is the fourth time in the last two weeks that a YouTube channel run by the South Korean government was hacked.,https://www.businessinsider.com/elon-musk-crypto-interview-streams-hacked-south-korean-governments-youtube-2022-9,https://i.insider.com/631567f8ed92be0018c5dd1d?width=1200&format=jpeg,2022-09-05T03:48:07Z,"The South Korean government's official YouTube channel was hacked on Saturday morning to broadcast a video featuring billionaire Elon Musk chatting about cryptocurrency, according to local media repo… [+1879 chars]"
121,"{'id': 'nbc-news', 'name': 'NBC News'}",MacKenzie Sigalos,Ethereum’s software upgrade just went live — here’s what it does,"Ethereum’s biggest-ever upgrade just took effect, in what industry experts are calling a game changer for the entire crypto sector.",https://www.nbcnews.com/tech/crypto/ethereums-software-upgrade-just-went-live-s-rcna47887,"https://media-cldnry.s-nbcnews.com/image/upload/t_nbcnews-fp-1200-630,f_auto,q_auto:best/rockcms/2022-09/220915-crypto-farm-ew-1012p-e45885.jpg",2022-09-15T14:16:01Z,"Ethereums biggest-ever upgrade just took effect, in what industry experts are calling a game changer for the entire crypto sector. Thus far, all signs suggest the so-called merge which is designed to… [+7098 chars]"
122,"{'id': 'nbc-news', 'name': 'NBC News'}",Reuters,U.S. seizes $30 mln in crypto from North Korea-linked hackers,"The United States has seized over $30 million in cryptocurrency stolen by North Korean-linked hackers Lazarus from the popular online game Axie Infinity,",https://www.nbcnews.com/tech/crypto/us-seizes-30-mln-crypto-north-korea-linked-hackers-rcna46929,"https://media-cldnry.s-nbcnews.com/image/upload/t_nbcnews-fp-1200-630,f_auto,q_auto:best/rockcms/2022-09/220908-north-korea-flag-jm-1508-8ec697.jpg",2022-09-08T19:30:37Z,"The United States has seized over $30 million in cryptocurrency stolen by North Korean-linked hackers Lazarus from the popular online game Axie Infinity, crypto intelligence firm Chainalysis said on … [+1155 chars]"
123,"{'id': 'nbc-news', 'name': 'NBC News'}",Reuters,Explainer: Understanding Ethereum’s major 'proof of stake' upgrade,"Ethereum, the blockchain that underpins the world’s second-largest crypto token ether, will soon undergo a major software upgrade that promises to slash the",https://www.nbcnews.com/tech/crypto/explainer-understanding-ethereums-major-proof-stake-upgrade-rcna46998,"https://media-cldnry.s-nbcnews.com/image/upload/t_nbcnews-fp-1200-630,f_auto,q_auto:best/rockcms/2022-09/220909-ethereum-crypto-farm-mn-0840-bbfc5e.jpg",2022-09-09T12:39:32Z,"Ethereum, the blockchain that underpins the worlds second-largest crypto token ether, will soon undergo a major software upgrade that promises to slash the amount of energy needed to create new coins… [+3296 chars]"
124,"{'id': 'the-verge', 'name': 'The Verge'}",Corin Faife,Hacker steals $160 million from crypto trading firm Wintermute,"Cryptocurrency market-making firm Wintermute has been hit by a hack that drained $160 million of USD Coin, Tether, Wrapped ETH, and other cryptocurrencies from the company’s liquidity reserves.",https://www.theverge.com/2022/9/20/23362864/hacker-crypto-steal-wintermute-theft,https://cdn.vox-cdn.com/thumbor/oVUM1UUMudMHCR4OYGyw36qBsQE=/0x0:2040x1360/1200x628/filters:focal(1020x680:1021x681)/cdn.vox-cdn.com/uploads/chorus_asset/file/23587765/acastro_220524_STK428_0001.jpg,2022-09-20T14:21:18Z,"Hacker steals $160 million from crypto trading firm Wintermute
Hacker steals $160 million from crypto trading firm Wintermute
 / A series of unauthorized transactions sent tens of millions of dolla… [+3161 chars]"
125,"{'id': 'the-verge', 'name': 'The Verge'}",Justine Calma,How The Merge will slash Ethereum’s climate pollution,"If “The Merge” is successful, Ethereum will use a fraction of the energy it used to. That’s supposed drastically cut down the cryptocurrency’s climate pollution. But there’s a lot that has to go right first.",https://www.theverge.com/2022/9/6/23339594/ethereum-merge-energy-pollution-proof-of-stake,https://cdn.vox-cdn.com/thumbor/rWhHRgz07z4UNnHnOzxFL8mm0o0=/0x357:5000x2975/fit-in/1200x630/cdn.vox-cdn.com/uploads/chorus_asset/file/24000086/1347898638.jpg,2022-09-06T23:25:23Z,"If The Merge is successful, it will drastically shrink the cryptocurrencys energy use
Computer equipment used by an Ethereum miner on October 20, 2021 in Vilassar de Mar, Spain.
Photo by Manuel Med… [+10018 chars]"
126,"{'id': 'techcrunch', 'name': 'TechCrunch'}",Mary Ann Azevedo,Insurtech goes niche,"Welcome to The Interchange! If you received this in your inbox, thank you for signing up and your vote of confidence. If you’re reading this as a post on our site, sign up here so you can receive it directly in the future. Every week, I’ll take a look at the …",https://techcrunch.com/2022/09/25/fintech-insurtech-goes-niche/,"https://techcrunch.com/wp-content/uploads/2019/05/GettyImages-991159346.jpg?resize=1200,814",2022-09-25T14:15:49Z,"Welcome to The Interchange! If you received this in your inbox, thank you for signing up and your vote of confidence. If youre reading this as a post on our site, sign up here so you can receive it d… [+11944 chars]"
127,"{'id': 'techcrunch', 'name': 'TechCrunch'}",Ram Iyer,"To reach fintech’s next level, infrastructure providers must address these pain points","As long as infrastructure providers are able to specialize to address the pain points of their customers, they can be an asset to any market they serve.",https://techcrunch.com/2022/09/01/to-reach-fintechs-next-level-infrastructure-providers-must-address-these-pain-points/,https://techcrunch.com/wp-content/uploads/2022/09/GettyImages-200560259-001.jpg?w=535,2022-09-01T14:00:39Z,"Weve all seen the headlines: Fintech is struggling. Since last year, valuations are down 70%-80%, deal activity is down 67% and layoffs have plagued many former industry favorites.
But fintech is re… [+2564 chars]"
