,source,author,title,description,url,urlToImage,publishedAt,content
63,"{'id': 'reuters', 'name': 'Reuters'}",,Galaxy Digital sued for $100 mln for ditching landmark Bitgo deal - Reuters,"Galaxy Digital Holdings Ltd <a href=""https://www.reuters.com/companies/GLXY.TO"" target=""_blank"">(GLXY.TO)</a>, a crypto financial services firm, should pay at least $100 million in damages for walking away from its $1.2 billion takeover deal for BitGo Inc, th…",https://www.reuters.com/markets/us/galaxy-digital-sued-100-mln-ditching-landmark-bitgo-deal-2022-09-15/,https://www.reuters.com/resizer/teeHNzBsi9AMvly7f-Yg9luqB5w=/728x381/smart/filters:quality(80)/cloudfront-us-east-2.images.arcpublishing.com/reuters/NR65SPJNYZIRFEOUYHVY2C3JOY.jpg,2022-09-15T21:52:00Z,"WILMINGTON, Del, Sept 15 (Reuters) - Galaxy Digital Holdings Ltd (GLXY.TO), a crypto financial services firm, should pay at least $100 million in damages for walking away from its $1.2 billion takeov… [+2006 chars]"
64,"{'id': 'business-insider', 'name': 'Business Insider'}",jsor@insider.com (Jennifer Sor),"Bankrupt crypto lender Celsius will allow withdrawals for some customers, potentially returning $210 million to users who were locked out during the summer sell-off","Separately, 64 customers petitioned to have their custodial deposits returned, arguing Celsius has the ability to do so.",https://markets.businessinsider.com/news/currencies/celsius-network-bankrupt-customers-crypto-lender-withdrawals-custodial-court-2022-9,https://i.insider.com/6310c9883e08f700196c596b?width=1200&format=jpeg,2022-09-01T15:53:07Z,"Crypto lender Celsius Network will allow withdrawals from some of its customers, potentially returning $210 million to users who were locked out of their accounts this summer.
Celsius paused custome… [+1329 chars]"
65,"{'id': 'reuters', 'name': 'Reuters'}",,Britain's financial watchdog says FTX may be operating in UK without authorisation - Reuters,Britain's Financial Conduct Authority said on Friday cryptocurrency exchange FTX may be offering financial services or products in the UK without its authorisation.,https://www.reuters.com/markets/currencies/britains-financial-watchdog-says-ftx-may-be-operating-uk-without-authorisation-2022-09-19/,https://www.reuters.com/resizer/4JFQDuw0k31yQzMlriMROLrLkb4=/1200x628/smart/filters:quality(80)/cloudfront-us-east-2.images.arcpublishing.com/reuters/3JH5OGF7X5LPZBM5DCKEV5VZTQ.jpg,2022-09-19T09:35:00Z,"LONDON, Sept 19 (Reuters) - Britain's Financial Conduct Authority said on Friday cryptocurrency exchange FTX may be offering financial services or products in the UK without its authorisation.
FTX i… [+1071 chars]"
66,"{'id': 'reuters', 'name': 'Reuters'}",,Ethereum blockchain to undergo major upgrade to cut energy use - Reuters,"A long-awaited software upgrade to the Ethereum blockchain aimed at slashing its huge energy consumption is expected this week, a move proponents say may widen the technology's use and support the price of the ether token.",https://www.reuters.com/technology/ethereum-blockchain-undergo-major-upgrade-cut-energy-use-2022-09-12/,https://www.reuters.com/resizer/HWiyTcArEAu74f-GanyvSnztwVs=/1200x628/smart/filters:quality(80)/cloudfront-us-east-2.images.arcpublishing.com/reuters/OYINZBIBIBOH3H346ZR47RSZAU.jpg,2022-09-12T10:39:00Z,"LONDON, Sept 12 (Reuters) - A long-awaited software upgrade to the Ethereum blockchain aimed at slashing its huge energy consumption is expected this week, a move proponents say may widen the technol… [+3142 chars]"
67,"{'id': 'business-insider', 'name': 'Business Insider'}","rhouston@businessinsider.com (Rickie Houston, CEPF)",Plynk investing review: Invest with unused gift cards and access jargon-free educational content,"Plynk offers DIY trading for new investors, while providing educational resources and letting you invest unused gift cards in stocks, ETFs, and more.",https://www.businessinsider.com/personal-finance/plynk-investing-review,https://i.insider.com/631b6402c3104e0012504b62?width=1200&format=jpeg,2022-09-13T16:42:39Z,"Insider's experts choose the best products and services to help make smart decisions with your money (heres how). In some cases, we receive a commission from our our partners, however, our opinions a… [+8370 chars]"
68,"{'id': 'business-insider', 'name': 'Business Insider'}",tmohamed@businessinsider.com (Theron Mohamed),JPMorgan CEO Jamie Dimon slammed crypto as dangerous - and called bitcoin a Ponzi scheme,"The billionaire banker argued that bitcoin and other speculative tokens don't do anything, and facilitate fraud, theft, and money laundering.",https://markets.businessinsider.com/news/currencies/jpmorgan-jamie-dimon-bitcoin-crypto-blockchain-regulation-crime-ponzi-scheme-2022-9,https://i.insider.com/60b0c30b02ac410018f934e3?width=1200&format=jpeg,2022-09-22T10:26:24Z,"Jamie Dimon has doubled down on his disdain for bitcoin and some other cryptocurrencies, arguing they serve no purpose beyond vacuuming up new buyers' money to pay out profits to their existing holde… [+2764 chars]"
69,"{'id': 'business-insider', 'name': 'Business Insider'}",ajoyner@businessinsider.com (April Joyner),SEC Chair Gary Gensler sends a message to crypto startup founders and VCs: 'This field will not take off unless you have some trust',SEC Chair Gary Gensler said at the NYC Summit that he believes most cryptocurrencies are securities and fall under his agency's scope.,https://www.businessinsider.com/sec-gary-gensler-crypto-regulation-startups-vcs-tokens-securities-2022-9,https://i.insider.com/60fae0f30729770012b98ffc?width=1200&format=jpeg,2022-09-08T16:32:04Z,"The crypto industry is not going to make it without increased regulation to build trust among investors and the general public, says Gary Gensler, the chair of the Securities and Exchange Commission.… [+1490 chars]"
70,"{'id': 'reuters', 'name': 'Reuters'}",,"Cryptoverse: After Merge, ether heads for a $20 billion Shanghai splurge - Reuters","Cryptoverse: After Merge, ether heads for a $20 billion Shanghai splurge  Reuters",https://www.reuters.com/technology/cryptoverse-after-merge-ether-heads-20-billion-shanghai-splurge-2022-09-20/,https://www.reuters.com/resizer/UIjhCUJTz8MlNe4Bl9Yi99qEna0=/1200x628/smart/filters:quality(80)/cloudfront-us-east-2.images.arcpublishing.com/reuters/HIDVAZOKRFI2JIH7BSDAMKEB2A.jpg,2022-09-20T05:24:00Z,"Sept 20 (Reuters) - The Merge came, saw and conquered. Not that you'd guess from crypto prices.
The Ethereum blockchain's mega-upgrade finally went live on Sept. 15, moving it to a less energy-inten… [+4269 chars]"
71,"{'id': 'business-insider', 'name': 'Business Insider'}",jbort@insider.com (Julie Bort),"Over 260 of the most promising startups of 2022 in edtech, fintech, crypto, proptech and more, according to VCs","Despite the rough economic environment for tech startups, some are thriving. We asked VCs to name the most promising ones across industries.",https://www.businessinsider.com/the-most-promising-startups-of-2022-according-to-vcs-2022-9,https://i.insider.com/630fb8383e08f700196c420c?width=1200&format=jpeg,2022-09-22T20:43:49Z,"Each year, we reach out to hundreds of VCs at nearly 100 firms and ask them to tell us which early stage startups are the most promising of the year.
VCs were asked to name startups within their por… [+1474 chars]"
72,"{'id': 'reuters', 'name': 'Reuters'}",,Cryptoverse: Bleeding bitcoin's holding out for a hero - Reuters,Cryptoverse: Bleeding bitcoin's holding out for a hero  Reuters,https://www.reuters.com/markets/europe/cryptoverse-bleeding-bitcoins-holding-out-hero-2022-08-30/,https://www.reuters.com/resizer/14CC3_xOfbC5OEGUr3z7N39xNHg=/1200x628/smart/filters:quality(80)/cloudfront-us-east-2.images.arcpublishing.com/reuters/BUOALE3VDVLURENRYFCO2JVESE.jpg,2022-08-30T05:16:00Z,"Aug 30 (Reuters) - Who can save bitcoin?
The world's biggest cryptocurrency can't seem to catch a break. It finally looked to be regaining strength this month, breaching $25,000 for the first time s… [+3695 chars]"
73,"{'id': 'business-insider', 'name': 'Business Insider'}",prosen@insider.com (Phil Rosen),Terra founder Do Kwon faces an arrest warrant in South Korea for alleged capital markets law violations,"A court in Seoul issued the warrant for Do Kwon and five others, according to a text message from the prosecutor's office cited by Bloomberg.",https://markets.businessinsider.com/news/currencies/terra-founder-do-kwon-arrest-warrant-south-korea-crypto-crash-2022-9,https://i.insider.com/62f264efcc15bf00182f8b2d?width=1200&format=jpeg,2022-09-14T13:10:23Z,"Terraform Labs founder Do Kwon is facing an arrest warrant issued by a South Korean court for alleged violations of a capital markets law, according to a Bloomberg report. 
The warrant also includes… [+1103 chars]"
74,"{'id': 'business-insider', 'name': 'Business Insider'}",prosen@insider.com (Phil Rosen),Billionaire FTX chief Sam Bankman-Fried says hawkish Fed policy and the dollar's historic climb is weighing on crypto,"At the SALT Conference in New York, the billionaire FTX chief discussed the strengthening dollar and crypto's bumpy year.",https://markets.businessinsider.com/news/currencies/ftx-sam-bankman-fried-fed-policy-dollar-hawkish-crypto-dip-2022-9,https://i.insider.com/6320b8c8e8b5000018510967?width=1200&format=jpeg,2022-09-13T17:27:06Z,"Billionaire Sam Bankman-Fried said stringent monetary policy from the Fed and soaring inflation have weighed on cryptocurrencies this year. 
""Dollars are up this year,"" Bankman-Fried said at the SAL… [+1176 chars]"
75,"{'id': 'business-insider', 'name': 'Business Insider'}",insider@insider.com (Louis DeNicola),What is cryptocurrency? Here's what to know about this increasingly popular digital currency before getting involved,"Cryptocurrencies are decentralized, digital currencies that use blockchain technology to manage transactions and keep them secure.",https://www.businessinsider.com/personal-finance/what-is-cryptocurrency,https://i.insider.com/61c08aecbc281e00184ed412?width=1200&format=jpeg,2022-09-23T21:15:06Z,"Insider's experts choose the best products and services to help make smart decisions with your money (heres how). In some cases, we receive a commission from our our partners, however, our opinions a… [+8777 chars]"
76,"{'id': 'business-insider', 'name': 'Business Insider'}",tmohamed@businessinsider.com (Theron Mohamed),"'Big Short' investor Michael Burry says the epic market crash he predicted is in full swing - and flags crypto, SPACs, and meme stocks as early victims","Burry, who repeatedly sounded the alarm on the boom in speculative assets, checked off his forecast of the bubble bursting as another correct call.",https://markets.businessinsider.com/news/stocks/big-short-michael-burry-meme-stocks-crypto-bubble-market-crash-2022-9,https://i.insider.com/6267b7d30bd64800192c32a6?width=1200&format=jpeg,2022-09-07T11:38:44Z,"Michael Burry identified a market bubble of unprecedented size and scope last summer, and warned the investors buying into the hype and speculation to brace for a historic crash.
The fund manager of… [+2311 chars]"
77,"{'id': 'business-insider', 'name': 'Business Insider'}",mfox@businessinsider.com (Matthew Fox),"The crypto bear market will continue if bitcoin confirms its recent breakdown below $20,000, Fairlead's Katie Stockton says","""Short-term momentum has shifted negative per a new daily MACD 'sell' signal,"" Fairlead Strategies' Katie Stockton said.",https://markets.businessinsider.com/news/currencies/crypto-bear-market-bitcoin-prices-20000-btc-breakdown-technical-analysis-2022-9,https://i.insider.com/632b4a2048c188001815b1f1?width=1200&format=jpeg,2022-09-21T18:14:47Z,"The crypto bear market is likely to continue as long as bitcoin confirms its recent breakdown below $20,000, according to a Tuesday note from Fairlead Strategies.
The technical analysis-focused rese… [+2155 chars]"
78,"{'id': 'reuters', 'name': 'Reuters'}",,"Ethereum blockchain has completed major software upgrade, co-founder says - Reuters","A major software upgrade to the Ethereum blockchain aimed at drastically reducing its energy usage has been completed, Vitalik Buterin, Ethereum inventor and co-founder tweeted on Thursday.",https://www.reuters.com/technology/ethereum-blockchain-has-completed-major-software-upgrade-co-founder-says-2022-09-15/,https://www.reuters.com/resizer/F81Dp-auWz2ULsuNYWSA54O0MI8=/1200x628/smart/filters:quality(80)/cloudfront-us-east-2.images.arcpublishing.com/reuters/QMGLSVUGONLBVKM52FOAB3NOLY.jpg,2022-09-15T07:11:00Z,"Sept 15 (Reuters) - A major software upgrade to the Ethereum blockchain aimed at drastically reducing its energy usage has been completed, Vitalik Buterin, Ethereum inventor and co-founder tweeted on… [+703 chars]"
79,"{'id': 'business-insider', 'name': 'Business Insider'}",stabahriti@insider.com (Sam Tabahriti),The 'head trader' of a $100 million investment fraud scheme posing as a crypto platform called EmpiresX has pleaded guilty,Joshua David Nicholas of EmpiresX pleaded guilty to conspiracy to commit securities fraud in what the Department of Justice said was a Ponzi scheme.,https://www.businessinsider.com/head-trader-fake-crypto-platform-empiresx-pleaded-guilty-fraud-2022-9,https://i.insider.com/631c47cdc3104e0012506951?width=1200&format=jpeg,2022-09-10T14:37:00Z,"The ""head trader"" of an investment fraud scheme posing as a cryptocurrency platform that defrauded investors of about $100 million has pleaded guilty to one count of conspiracy to commit securities f… [+1577 chars]"
80,"{'id': 'business-insider', 'name': 'Business Insider'}",mloh@businessinsider.com (Matthew Loh),Elon Musk's crypto interview was broadcast on the South Korean government's YouTube channel that was hacked and renamed 'SpaceX Invest',The breach on Saturday morning is the fourth time in the last two weeks that a YouTube channel run by the South Korean government was hacked.,https://www.businessinsider.com/elon-musk-crypto-interview-streams-hacked-south-korean-governments-youtube-2022-9,https://i.insider.com/631567f8ed92be0018c5dd1d?width=1200&format=jpeg,2022-09-05T03:48:07Z,"The South Korean government's official YouTube channel was hacked on Saturday morning to broadcast a video featuring billionaire Elon Musk chatting about cryptocurrency, according to local media repo… [+1879 chars]"
81,"{'id': 'business-insider', 'name': 'Business Insider'}",prosen@insider.com (Phil Rosen),"Michael Saylor's MicroStrategy buys the dip with fresh $6 million bitcoin purchase, adding to its crypto stockpile","As of September 22, MicroStrategy and its subsidiaries own about 130,000 bitcoins, bought at an average price of about $30,639, per Bloomberg.",https://markets.businessinsider.com/news/stocks/michael-saylor-microstrategy-buy-dip-million-bitcoin-cryptocurrency-eth-crypto-2022-9,https://i.insider.com/6329c0bc4f9291001883ce01?width=1200&format=jpeg,2022-09-20T14:31:20Z,"MicroStrategy, helmed by famed bitcoin-bull Michael Saylor, purchased about $6 million in bitcoin between August 2 and September 19, a Tuesday SEC filing showed.
That's good for about 301 bitcoin, b… [+1049 chars]"
82,"{'id': 'business-insider', 'name': 'Business Insider'}",bevans@insider.com (Brian Evans),Dow slides 300 points as investors brace for rate-hike decision from the Federal Reserve,"The 2-year Treasury yield, which is sensitive to Fed moves, surged as high as 3.983% intraday to hit the highest rate since 2007.",https://markets.businessinsider.com/news/stocks/stock-market-news-today-dow-300-points-fed-rate-hike-2022-9,https://i.insider.com/632a130fedbe7f00190f175e?width=1200&format=jpeg,2022-09-20T20:06:26Z,"US stocks finished lower Tuesday as investors anxiously await interest rate guidance from the Federal Reserve's policy meeting. 
Stocks are under pressure from an anticipated 75-basis-point rate hik… [+548 chars]"
83,"{'id': 'business-insider', 'name': 'Business Insider'}",bevans@insider.com (Brian Evans),US stocks slip as the Fed begins its policy meeting and the 10-year yield hits a fresh 11-year high,The Federal Open Market Committee began its highly anticipated two-day meeting on Tuesday.,https://markets.businessinsider.com/news/stocks/stock-market-news-stocks-fall-fed-policy-meeting-interest-inflation-2022-9,https://i.insider.com/62b9b45d9f5e550019aabbe6?width=1200&format=jpeg,2022-09-20T13:42:59Z,"US stocks fell Tuesday as investors eyed the beginning of the latest central bank policy meeting that could spur more market fallout. 
The meeting concludes on Wednesday, and Wall Street is anticipa… [+542 chars]"
84,"{'id': 'business-insider', 'name': 'Business Insider'}",jma@insider.com (Jason Ma),Dow plunges 485 points to hit new closing low for the year as interest rate and recession fears roil markets,"The Dow Jones Industrial Average lost 4.5% on the week, the S&P 500 gave up 5.2%, and the Nasdaq tumbled 5.5%.",https://markets.businessinsider.com/news/stocks/stock-market-news-today-dow-bear-market-sp500-closing-low-2022-9,https://i.insider.com/629fae53caad7400180e7d62?width=1200&format=jpeg,2022-09-23T20:10:03Z,"US stocks sold off for a fourth straight day on Friday as fears of higher interest rates and slowing economic growth continued to roil markets.
The Dow Jones Industrial Average entered a bear market… [+710 chars]"
85,"{'id': 'wired', 'name': 'Wired'}",Anthony Lydgate,Would You Ditch All This Chaos for a Country in the Cloud?,"Balaji Srinivasan—technologist, investor, prophet, troll—says let the old world sink. Find your tribe and build your bespoke society, or get left behind.",https://www.wired.com/story/would-you-ditch-all-this-chaos-for-a-country-in-the-cloud/,"https://media.wired.com/photos/630e61933dfe1372fb611109/191:100/w_1280,c_limit/WI100122_FF_Sovereign_01.jpg",2022-09-06T10:00:00Z,"As he accrues hundreds of thousands more Twitter followers, Srinivasan dispenses short-term advice (work from home, cancel group events, ramp up testing capacity, stop making comparisons with the flu… [+4906 chars]"
86,"{'id': 'business-insider', 'name': 'Business Insider'}",insider@insider.com (Sam Becker),How to make an NFT: A step-by-step guide to creating non-fungible tokens,"Making an NFT may sound like a technical process, but for most people familiar with the digital asset, it's simple.",https://www.businessinsider.com/personal-finance/how-to-make-an-nft,https://i.insider.com/630774aa830ed800183fb45f?width=1200&format=jpeg,2022-08-25T20:50:37Z,"Non-fungible tokens, or NFTs, have become a market mainstay. Although they're not necessarily new, NFTs have gained steam as artists use them to sell digital artwork, and traders jump on board to mak… [+9989 chars]"
87,"{'id': 'business-insider', 'name': 'Business Insider'}",bnguyen@insider.com (Britney Nguyen),"A 23-year-old, self-described 'Crypto King' reportedly had his Lamborghini, BMWs, and McLarens seized after investors sued him claiming he stole $35 million",Around 140 investors reportedly gave at least $35 million to Aiden Pleterski's company as cryptocurrency and foreign exchange investments.,https://www.businessinsider.com/self-described-crypto-king-aiden-pleterski-sued-cars-seized-report-2022-9,https://i.insider.com/632b8151f576c60018fc282b?width=1200&format=jpeg,2022-09-21T22:06:37Z,"A 23-year-old Canadian who calls himself the ""Crypto King"" reportedly had $2 million worth of assets seized as he's being sued over allegations he defrauded investors.
The seized assets of the man, … [+2193 chars]"
88,"{'id': 'reuters', 'name': 'Reuters'}",,European markets watchdog on red alert for Ukraine war contagion - Reuters.com,The European Union's markets watchdog said on Thursday it was on red alert for contagion after inflation stoked by Russia's invasion of Ukraine has threatened markets' ability to function in an orderly way.,https://www.reuters.com/markets/europe/european-markets-watchdog-red-alert-ukraine-war-contagion-2022-09-01/,https://www.reuters.com/resizer/vd3KDhLtPRLb7dFCaTWDabU4Op0=/1200x628/smart/filters:quality(80)/cloudfront-us-east-2.images.arcpublishing.com/reuters/DKDWERQNQBNL5KVZPDC4NVE6GU.jpg,2022-09-01T09:08:00Z,"LONDON, Sept 1 (Reuters) - The European Union's markets watchdog said on Thursday it was on red alert for contagion after inflation stoked by Russia's invasion of Ukraine has threatened markets' abil… [+1922 chars]"
89,"{'id': 'reuters', 'name': 'Reuters'}",,Lululemon stretches inventory logic - Reuters.com,"Like a small leggings tear, Lululemon Athletica’s <a href=""https://www.reuters.com/companies/LULU.O"" target=""_blank"">(LULU.O)</a> inventory issues could unravel. The $41 billion yoga-pants maker’s <a href=""https://corporate.lululemon.com/media/press-releases/…",https://www.reuters.com/breakingviews/lululemon-stretches-inventory-logic-2022-09-02/,https://www.reuters.com/resizer/qEJ0prUpclBgppeoGmmGpInR1BM=/1200x628/smart/filters:quality(80)/cloudfront-us-east-2.images.arcpublishing.com/reuters/L3CZP6XPMRPK3IPFBOTHCFEU4M.jpg,2022-09-02T16:56:00Z,"TORONTO, Sept 2 (Reuters Breakingviews) - Like a small leggings tear, Lululemon Athleticas (LULU.O) inventory issues could unravel. The $41 billion yoga-pants makers second-quarter revenue increased … [+1911 chars]"
90,"{'id': 'reuters', 'name': 'Reuters'}",,Bitcoin falls below $19000 as cryptos creak under rate hike risk - Reuters,Cryptocurrencies fell to fresh lows on Monday on regulatory concerns and as investors globally turned shy on risky assets with interest rate rises looming around the world.,https://www.reuters.com/technology/bitcoin-falls-below-19000-cryptos-creak-under-rate-hike-risk-2022-09-19/,https://www.reuters.com/resizer/7vvHHpQvDtdEIXqXAS7vTw_ipPo=/1200x628/smart/filters:quality(80)/cloudfront-us-east-2.images.arcpublishing.com/reuters/36XAVNUD7ZKANCOL2HEUR2FOKU.jpg,2022-09-19T06:38:00Z,"SINGAPORE, Sept 19 (Reuters) - Cryptocurrencies fell to fresh lows on Monday on regulatory concerns and as investors globally turned shy on risky assets with interest rate rises looming around the wo… [+1578 chars]"
91,"{'id': 'reuters', 'name': 'Reuters'}",,Central African Republic top court blocks purchases with new cryptocurrency - Reuters,"Central African Republic's Constitutional Court on Monday ruled that the purchase of citizenship, ""e-residency"" and land using a cryptocurrency the government launched last month was unconstitutional.",https://www.reuters.com/technology/central-african-republic-top-court-blocks-purchases-with-new-cryptocurrency-2022-08-29/,https://www.reuters.com/pf/resources/images/reuters/reuters-default.png?d=108,2022-08-29T18:10:00Z,"BANGUI, Aug 29 (Reuters) - Central African Republic's Constitutional Court on Monday ruled that the purchase of citizenship, ""e-residency"" and land using a cryptocurrency the government launched last… [+1894 chars]"
92,"{'id': 'reuters', 'name': 'Reuters'}",,FTX Ventures plans to take 30% stake in Scaramucci's SkyBridge Capital - Reuters.com,"FTX Ventures plans to scoop up a 30% stake in SkyBridge Capital, the companies said, making it the latest in a flurry of deals by cryptocurrency's white knight Sam Bankman-Fried.",https://www.reuters.com/markets/us/ftx-ventures-plans-take-30-stake-scaramuccis-skybridge-capital-2022-09-09/,https://www.reuters.com/resizer/zPx2WMSTYuElLMv1Os9l3ArPP2E=/1200x628/smart/filters:quality(80)/cloudfront-us-east-2.images.arcpublishing.com/reuters/BSGYVH6XH5J4ZNGCDKEOTYP6AA.jpg,2022-09-09T12:26:00Z,"Sept 9 (Reuters) - FTX Ventures plans to scoop up a 30% stake in SkyBridge Capital, the companies said, making it the latest in a flurry of deals by cryptocurrency's white knight Sam Bankman-Fried.
… [+1669 chars]"
93,"{'id': 'reuters', 'name': 'Reuters'}",,"Instacart cuts staff, curbs hiring before IPO -The Information - Reuters","Grocery delivery app Instacart Inc has been letting go staff, slowing hiring and curbing other expenses as it heads toward a public listing, <a href=""https://bit.ly/3SySs6e"" target=""_blank"">the Information</a> reported on Saturday, citing people familiar with…",https://www.reuters.com/business/retail-consumer/instacart-cuts-staff-curbs-hiring-before-ipo-the-information-2022-09-25/,https://www.reuters.com/resizer/GNei_dCCNtYIkMJl5yyiZeiFpVM=/1200x628/smart/filters:quality(80)/cloudfront-us-east-2.images.arcpublishing.com/reuters/B5A6PVVNTJNUTOXJAU6Z3ZREMI.jpg,2022-09-25T00:36:00Z,"Sept 24 (Reuters) - Grocery delivery app Instacart Inc has been letting go staff, slowing hiring and curbing other expenses as it heads toward a public listing, the Information reported on Saturday, … [+1607 chars]"
94,"{'id': 'business-insider', 'name': 'Business Insider'}",prosen@insider.com (Phil Rosen),The Dow sheds 300 points and bond yields climb amid warnings about the global economy,"From the Federal Reserve to the Bank of Japan, central banks made key rate adjustments this week that rattled markets.",https://markets.businessinsider.com/news/stocks/stock-market-news-today-dow-recession-bond-yields-climb-fed-2022-9,https://i.insider.com/5f5733a0e6ff30001d4e7632?width=1200&format=jpeg,2022-09-23T13:37:13Z,"US stocks tumbled Friday and bond yields continued to climb amid new warnings on the global economy. 
The Dow lost more than 300 points, and each of the major indexes face their fourth losing sessio… [+854 chars]"
